{
  "$schema": "https://json-schema.org/draft/2020-12/schema",
  "$id": "split-decision/contracts/case.schema.json",
  "title": "Split Decision case record",
  "description": "One benchmark or pending case, assembled by ingest_cases.py from CourtListener + SCDB (scdb.wustl.edu) + Oyez. ground_truth and date_decided are null for pending cases. Contamination guard: decided cases must post-date 2025-06-01.",
  "type": "object",
  "properties": {
    "case_id": {
      "description": "cl-cluster-N for CourtListener-sourced cases; scdb-CASEID for historical memorization-check cases; landmark-N for the famous memorization tier (data/precedents/landmark_cases.json); oyez-N for pending cases (no cluster exists until decision)",
      "type": "string",
      "pattern": "^(cl-cluster-[0-9]+|scdb-[A-Za-z0-9-]+|landmark-[0-9]+|oyez-[0-9]+)$"
    },
    "name": { "type": "string", "minLength": 1 },
    "docket": { "type": "string", "minLength": 1 },
    "date_argued": {
      "description": "null for pending cases granted cert but not yet argued (OT2026 prediction set)",
      "oneOf": [{ "type": "string", "format": "date" }, { "type": "null" }]
    },
    "date_decided": {
      "oneOf": [{ "type": "string", "format": "date" }, { "type": "null" }]
    },
    "question_presented": {
      "description": "From Oyez or the syllabus",
      "type": "string",
      "minLength": 1
    },
    "facts_summary": {
      "description": "Clerk-generated, ≤400 words",
      "type": "string",
      "minLength": 1
    },
    "lower_court_ruling": { "type": "string", "minLength": 1 },
    "opinion_excerpt_urls": {
      "type": "array",
      "items": { "type": "string", "format": "uri" }
    },
    "ground_truth": {
      "oneOf": [
        {
          "type": "object",
          "properties": {
            "disposition": { "enum": ["affirmed", "reversed"] },
            "vote_split": {
              "description": "N-M, or 'unknown' when the opinion text does not state the lineup (split-distance metric skips these)",
              "type": "string",
              "pattern": "^([0-9]-[0-9]|unknown)$"
            },
            "scdb_id": {
              "description": "SCDB caseId; null when the outcome was hand-coded because SCDB lags",
              "oneOf": [{ "type": "string", "minLength": 1 }, { "type": "null" }]
            }
          },
          "required": ["disposition", "vote_split", "scdb_id"],
          "additionalProperties": false
        },
        { "type": "null" }
      ]
    },
    "status": { "enum": ["decided", "pending"] }
  },
  "required": [
    "case_id",
    "name",
    "docket",
    "date_argued",
    "date_decided",
    "question_presented",
    "facts_summary",
    "lower_court_ruling",
    "opinion_excerpt_urls",
    "ground_truth",
    "status"
  ],
  "additionalProperties": false,
  "allOf": [
    {
      "description": "pending ⇔ no decision date and no ground truth",
      "if": { "properties": { "status": { "const": "pending" } } },
      "then": {
        "properties": {
          "date_decided": { "type": "null" },
          "ground_truth": { "type": "null" }
        }
      },
      "else": {
        "properties": {
          "date_decided": { "type": "string" },
          "ground_truth": { "type": "object" }
        }
      }
    }
  ]
}
