{
  "case_id": "cl-cluster-10772450",
  "name": "Bowe v. United States",
  "docket": "n/a",
  "date_argued": "2026-01-09",
  "date_decided": "2026-01-09",
  "question_presented": "(Slip Opinion) OCTOBER TERM, 2025 1 Syllabus NOTE: Where it is feasible, a syllabus (headnote) will be released, as is being done in connection with this case, at the time the opinion is issued. The syllabus constitutes no part of the opinion of the Court but has been prepared by the Reporter of Decisions for the convenience of the reader. See United States v. Detroit Timber & Lumber Co., 200 U. S. 321, 337. SUPREME COURT OF THE UNITED STATES Syllabus BOWE v. UNITED STATES CERTIORARI TO THE UNITED STATES COURT OF APPEALS FOR THE ELEVENTH CIRCUIT No. 24\u20135438. Argued October 14, 2025\u2014Decided January 9, 2026 Petitioner Michael S. Bowe is serving a 24-year sentence in federal cus- tody after",
  "facts_summary": "(Slip Opinion) OCTOBER TERM, 2025 1 Syllabus NOTE: Where it is feasible, a syllabus (headnote) will be released, as is being done in connection with this case, at the time the opinion is issued. The syllabus constitutes no part of the opinion of the Court but has been prepared by the Reporter of Decisions for the convenience of the reader. See United States v. Detroit Timber & Lumber Co., 200 U. S. 321, 337. SUPREME COURT OF THE UNITED STATES Syllabus BOWE v. UNITED STATES CERTIORARI TO THE UNITED STATES COURT OF APPEALS FOR THE ELEVENTH CIRCUIT No. 24\u20135438. Argued October 14, 2025\u2014Decided January 9, 2026 Petitioner Michael S. Bowe is serving a 24-year sentence in federal cus- tody after pleading guilty in 2008 to three offenses: (1) conspiracy to commit Hobbs Act robbery; (2) attempted Hobbs Act robbery; and (3) using a firearm in relation to a \u201ccrime of violence\u201d as defined in 18 U. S. C. \u00a7924(c)(1)(A). Bowe\u2019s \u00a7924(c) conviction carried a manda- tory 10-year sentence to be served consecutively to his sentence for the robbery offenses. To have been properly convicted under \u00a7924(c), at least one of Bowe\u2019s other offenses must qualify as a \u201ccrime of violence\u201d under one of two definitional clauses in \u00a7924(c): the \u201celements clause,\u201d \u00a7924(c)(3)(A), or the \u201cresidual clause,\u201d \u00a7924(c)(3)(B). But decisions is- sued years after Bowe\u2019s conviction call into question whether either clause can support his \u00a7924(c) conviction. See United States v. Davis, 588 U. S. 445, 470 (residual clause void for vagueness); United States v. Taylor, 596 U. S. 845, 860 (attempted Hobbs Act robbery is not a crime of violence under the elements clause). This case concerns Bowe\u2019s efforts to obtain postconviction relief from the mandatory consecutive 10-year sentence imposed under \u00a7924(c). A comprehensive statutory scheme governs when and how state and fed- eral prisoners can seek postconviction relief in federal court. See 28 U. S. C. \u00a72254 (state prisoners); \u00a72255 (federal prisoners). Particu- larly relevant here, under the Antiterrorism and Effective Death Pen- alty Act of 1996 (AEDPA), second or subsequent efforts at obtaining postconviction relief require the prisoner first to seek certification from a court of appeals that the filing meets threshold conditions before a prisoner can proceed in a district court. See \u00a72244 (authorization re- quests by state prisoners); \u00a72255(h) (successive-motion requests by federal prisoners). While \u00a7\u00a72244 and 2255(h) have distinct 2 BOWE v. UNITED STATES Syllabus",
  "lower_court_ruling": "see syllabus",
  "opinion_excerpt_urls": [
    "https://www.courtlistener.com/opinion/10772450/bowe-v-united-states/"
  ],
  "ground_truth": {
    "disposition": "reversed",
    "vote_split": "unknown",
    "scdb_id": null
  },
  "status": "decided"
}
