{
  "case_id": "cl-cluster-10776817",
  "name": "Mahmoud v. Taylor",
  "docket": "n/a",
  "date_argued": "2025-06-27",
  "date_decided": "2025-06-27",
  "question_presented": "PRELIMINARY PRINT Volume 606 U. S. Part 2 Pages 522\u2013655 OFFICIAL REPORTS OF THE SUPREME COURT June 27, 2025 Page Proof Pending Publication REBECCA A. WOMELDORF reporter of decisions NOTICE: This preliminary print is subject to formal revision before the bound volume is published. Users are requested to notify the Reporter of Decisions, Supreme Court of the United States, Washington, D. C. 20543, pio@supremecourt.gov, of any typographical or other formal errors. 522 OCTOBER TERM, 2024 Syllabus MAHMOUD et al. v. TAYLOR et al. certiorari to the united states court of appeals for the fourth circuit No. 24\u2013297. Argued April 22, 2025\u2014Decided June 27, 2025 During the 2022\u20132023 school year, the Montgomery County Board of Edu- cation (Board) introduced a variety",
  "facts_summary": "PRELIMINARY PRINT Volume 606 U. S. Part 2 Pages 522\u2013655 OFFICIAL REPORTS OF THE SUPREME COURT June 27, 2025 Page Proof Pending Publication REBECCA A. WOMELDORF reporter of decisions NOTICE: This preliminary print is subject to formal revision before the bound volume is published. Users are requested to notify the Reporter of Decisions, Supreme Court of the United States, Washington, D. C. 20543, pio@supremecourt.gov, of any typographical or other formal errors. 522 OCTOBER TERM, 2024 Syllabus MAHMOUD et al. v. TAYLOR et al. certiorari to the united states court of appeals for the fourth circuit No. 24\u2013297. Argued April 22, 2025\u2014Decided June 27, 2025 During the 2022\u20132023 school year, the Montgomery County Board of Edu- cation (Board) introduced a variety of \u201cLGBTQ+-inclusive\u201d texts into the public school curriculum. Those texts included fve \u201cLGBTQ+- inclusive\u201d storybooks approved for students in kindergarten through ffth grade, which have story lines focused on sexuality and gender. When parents in Montgomery County sought to have their children ex- cused from instruction involving those books, the Board initially com- promised with the parents by notifying them when the \u201cLGBTQ+- inclusive\u201d storybooks would be taught and permitting their children to be excused from the instruction. That compromise was consistent with the Board's \u201cGuidelines for Respecting Religious Diversity,\u201d which pro- fessed a commitment to making \u201creasonable accommodations\u201d for the religious \u201cbeliefs and practices\u201d of students. Less than a year after the Page Proof Pending Publication Board introduced the books, however, it rescinded the parental opt out policy. Among other things, the Board said that it \u201ccould not accom- modate the growing number of opt out requests without causing sig- nifcant disruptions to the classroom environment.\u201d App. to Pet. for Cert. 607a. The petitioners here are a group of individual parents and an unincor- porated association of other interested parties. The individual parents come from diverse religious backgrounds and hold sincere views on sex- uality and gender which they wish to pass on to their children. Faced with the Board's decision to rescind opt outs, petitioners fled a lawsuit in the United States District Court for the District of Maryland. Among other things, they asserted that the Board's no-opt-out policy infringed on parents' right to the free exercise of their religion. See Kennedy v. Bremerton School Dist., 597 U. S. 507, 524. They relied heavily on Wisconsin v. Yoder, 406 U. S. 205, in which the Court recog- nized",
  "lower_court_ruling": "see syllabus",
  "opinion_excerpt_urls": [
    "https://www.courtlistener.com/opinion/10776817/mahmoud-v-taylor/"
  ],
  "ground_truth": {
    "disposition": "reversed",
    "vote_split": "unknown",
    "scdb_id": null
  },
  "status": "decided"
}
