{
  "case_id": "landmark-15",
  "name": "New York Times Co. v. Sullivan",
  "docket": "n/a",
  "date_argued": "1964-03-09",
  "date_decided": "1964-03-09",
  "question_presented": "Memorization-check set: predict the Supreme Court's disposition in New York Times Co. v. Sullivan (376 U.S. 254, 1964).",
  "facts_summary": "Historical case in the memorization-check arm (famous tier). By design, only the case name, citation, and year are provided \u2014 this arm measures recall of memorized outcomes, not reasoning.",
  "lower_court_ruling": "not provided (memorization-check arm)",
  "opinion_excerpt_urls": [],
  "ground_truth": {
    "disposition": "reversed",
    "vote_split": "9-0",
    "scdb_id": null
  },
  "status": "decided"
}
