{
  "case_id": "scdb-1946-021",
  "name": "EAGLES, POST COMMANDING OFFICER, v. UNITED STATES EX REL. HOROWITZ",
  "docket": "58",
  "date_argued": "1946-12-23",
  "date_decided": "1946-12-23",
  "question_presented": "Memorization-check set: predict the Supreme Court's disposition in EAGLES, POST COMMANDING OFFICER, v. UNITED STATES EX REL. HOROWITZ (329 U.S. 317, 1946 Term).",
  "facts_summary": "Historical case in the memorization-check arm. By design, only the case name, citation, and term are provided \u2014 this arm measures recall of memorized outcomes, not reasoning.",
  "lower_court_ruling": "not provided (memorization-check arm)",
  "opinion_excerpt_urls": [],
  "ground_truth": {
    "disposition": "reversed",
    "vote_split": "9-0",
    "scdb_id": "1946-021"
  },
  "status": "decided"
}
