{
  "case_id": "cl-cluster-10850133",
  "name": "First Choice Women's Resource Centers, Inc. v. Davenport",
  "docket": "n/a",
  "date_argued": "2026-04-29",
  "date_decided": "2026-04-29",
  "question_presented": "(Slip Opinion) OCTOBER TERM, 2025 1 Syllabus NOTE: Where it is feasible, a syllabus (headnote) will be released, as is being done in connection with this case, at the time the opinion is issued. The syllabus constitutes no part of the opinion of the Court but has been prepared by the Reporter of Decisions for the convenience of the reader. See United States v. Detroit Timber & Lumber Co., 200 U. S. 321, 337. SUPREME COURT OF THE UNITED STATES Syllabus FIRST CHOICE WOMEN\u2019S RESOURCE CENTERS, INC. v. DAVENPORT, ATTORNEY GENERAL OF NEW JERSEY CERTIORARI TO THE UNITED STATES COURT OF APPEALS FOR THE THIRD CIRCUIT No. 24\u2013781. Argued December 2, 2025\u2014Decided April 29, 2026 First Choice Women\u2019s Resource Centers,",
  "facts_summary": "(Slip Opinion) OCTOBER TERM, 2025 1 Syllabus NOTE: Where it is feasible, a syllabus (headnote) will be released, as is being done in connection with this case, at the time the opinion is issued. The syllabus constitutes no part of the opinion of the Court but has been prepared by the Reporter of Decisions for the convenience of the reader. See United States v. Detroit Timber & Lumber Co., 200 U. S. 321, 337. SUPREME COURT OF THE UNITED STATES Syllabus FIRST CHOICE WOMEN\u2019S RESOURCE CENTERS, INC. v. DAVENPORT, ATTORNEY GENERAL OF NEW JERSEY CERTIORARI TO THE UNITED STATES COURT OF APPEALS FOR THE THIRD CIRCUIT No. 24\u2013781. Argued December 2, 2025\u2014Decided April 29, 2026 First Choice Women\u2019s Resource Centers, Inc., is a religious nonprofit or- ganization that has provided counseling and resources to pregnant women in New Jersey since 1985. Believing that life begins at concep- tion, the group does not provide abortions or refer clients to others for abortions. In 2022, New Jersey\u2019s Attorney General established a \u201cRe- productive Rights Strike Force\u201d that issued a consumer alert accusing groups like First Choice of seeking to prevent people from accessing reproductive health care by providing false or misleading abortion in- formation. The Attorney General served a subpoena on First Choice, commanding the group to produce 28 categories of documents, includ- ing documents reflecting the names, phone numbers, addresses, and places of employment of all individuals who had made donations to First Choice by any means other than through one specific webpage. Effectively, that demand required First Choice to provide personal in- formation about donors who gave through two other websites, through the group\u2019s various social media pages, by mail, in person, or by any other means. The subpoena warned twice that failure to comply may render the group liable for contempt of court and other penalties. First Choice filed suit in federal district court under 42 U. S. C. \u00a71983, seeking to prevent the Attorney General from enforcing the doc- ument demands and arguing that the demand for donor information violated its First Amendment rights. First Choice alleged that its in- ability to guarantee its donors\u2019 anonymity in the face of the Attorney General\u2019s demands injured the group by discouraging donors from as- sociating with it. 2 FIRST CHOICE WOMEN\u2019S RESOURCE CENTERS, INC. v. DAVENPORT Syllabus The district court denied First Choice\u2019s motion for a preliminary in- junction and",
  "lower_court_ruling": "see syllabus",
  "opinion_excerpt_urls": [
    "https://www.courtlistener.com/opinion/10850133/first-choice-womens-resource-centers-inc-v-davenport/"
  ],
  "ground_truth": {
    "disposition": "reversed",
    "vote_split": "unknown",
    "scdb_id": null
  },
  "status": "decided"
}
