{
  "case_id": "scdb-1965-038",
  "name": "KOEHRING CO. v. HYDE CONSTRUCTION CO., INC., et al.",
  "docket": "593",
  "date_argued": "1966-01-17",
  "date_decided": "1966-01-17",
  "question_presented": "Memorization-check set: predict the Supreme Court's disposition in KOEHRING CO. v. HYDE CONSTRUCTION CO., INC., et al. (382 U.S. 362, 1965 Term).",
  "facts_summary": "Historical case in the memorization-check arm. By design, only the case name, citation, and term are provided \u2014 this arm measures recall of memorized outcomes, not reasoning.",
  "lower_court_ruling": "not provided (memorization-check arm)",
  "opinion_excerpt_urls": [],
  "ground_truth": {
    "disposition": "reversed",
    "vote_split": "7-2",
    "scdb_id": "1965-038"
  },
  "status": "decided"
}
