{
  "case_id": "cl-cluster-10776830",
  "name": "Diamond Alternative Energy, LLC v. EPA",
  "docket": "n/a",
  "date_argued": "2025-06-20",
  "date_decided": "2025-06-20",
  "question_presented": "PRELIMINARY PRINT Volume 606 U. S. Part 1 Pages 100\u2013145 OFFICIAL REPORTS OF THE SUPREME COURT June 20, 2025 Page Proof Pending Publication REBECCA A. WOMELDORF reporter of decisions NOTICE: This preliminary print is subject to formal revision before the bound volume is published. Users are requested to notify the Reporter of Decisions, Supreme Court of the United States, Washington, D. C. 20543, pio@supremecourt.gov, of any typographical or other formal errors. 100 OCTOBER TERM, 2024 Syllabus DIAMOND ALTERNATIVE ENERGY, LLC, et al. v. ENVIRONMENTAL PROTECTION AGENCY et al. certiorari to the united states court of appeals for the district of columbia circuit No. 24\u20137. Argued April 23, 2025\u2014Decided June 20, 2025 Under the Clean Air Act, the Environmental Protection Agency",
  "facts_summary": "PRELIMINARY PRINT Volume 606 U. S. Part 1 Pages 100\u2013145 OFFICIAL REPORTS OF THE SUPREME COURT June 20, 2025 Page Proof Pending Publication REBECCA A. WOMELDORF reporter of decisions NOTICE: This preliminary print is subject to formal revision before the bound volume is published. Users are requested to notify the Reporter of Decisions, Supreme Court of the United States, Washington, D. C. 20543, pio@supremecourt.gov, of any typographical or other formal errors. 100 OCTOBER TERM, 2024 Syllabus DIAMOND ALTERNATIVE ENERGY, LLC, et al. v. ENVIRONMENTAL PROTECTION AGENCY et al. certiorari to the united states court of appeals for the district of columbia circuit No. 24\u20137. Argued April 23, 2025\u2014Decided June 20, 2025 Under the Clean Air Act, the Environmental Protection Agency (EPA) approved California regulations that require automakers to manufac- ture more electric vehicles and fewer gasoline-powered vehicles with a goal of decreasing emissions from liquid fuels. The regulations require automakers to limit average greenhouse-gas emissions across their vehi- cle feets and manufacture a certain percentage of electric vehicles. Several producers of fuels such as gasoline and ethanol sued EPA in the D. C. Circuit, arguing that EPA lacked authority to approve the Califor- nia regulations because they target global climate change rather than local California air quality problems as required by the Clean Air Act. They submitted standing declarations explaining that California's regu- lations depress demand for liquid fuel by requiring vehicles that use less Page Proof Pending Publication or no liquid fuel, causing the fuel producers monetary injury. Califor- nia's own estimates indicated the regulations would cause substantial reductions in demand for gasoline exceeding $1 billion beginning in 2020 and increasing to over $10 billion in 2030. EPA did not challenge the fuel producers' standing in the D. C. Cir- cuit. California, as well as other States adopting California's regula- tions, intervened to defend EPA's approval. California argued that the fuel producers lacked standing because automobile manufacturers would not change course if EPA's decision were vacated given the \u201csurging consumer demand\u201d for electric vehicles. The D. C. Circuit held that the fuel producers lacked Article III standing, fnding they failed to estab- lish that automakers would likely respond to invalidation of the regula- tions by producing fewer electric vehicles and more gasoline-powered vehicles. Held: The fuel producers have Article III standing to challenge EPA's approval of the California regulations. Pp. 110\u2013126. (a) Article III limits federal court jurisdiction to",
  "lower_court_ruling": "see syllabus",
  "opinion_excerpt_urls": [
    "https://www.courtlistener.com/opinion/10776830/diamond-alternative-energy-llc-v-epa/"
  ],
  "ground_truth": {
    "disposition": "reversed",
    "vote_split": "unknown",
    "scdb_id": null
  },
  "status": "decided"
}
