{
  "case_id": "scdb-1964-091",
  "name": "MCKINNIE et al. v. TENNESSEE",
  "docket": "148",
  "date_argued": "1965-04-05",
  "date_decided": "1965-04-05",
  "question_presented": "Memorization-check set: predict the Supreme Court's disposition in MCKINNIE et al. v. TENNESSEE (380 U.S. 449, 1964 Term).",
  "facts_summary": "Historical case in the memorization-check arm. By design, only the case name, citation, and term are provided \u2014 this arm measures recall of memorized outcomes, not reasoning.",
  "lower_court_ruling": "not provided (memorization-check arm)",
  "opinion_excerpt_urls": [],
  "ground_truth": {
    "disposition": "reversed",
    "vote_split": "5-4",
    "scdb_id": "1964-091"
  },
  "status": "decided"
}
