{
  "case_id": "scdb-2003-031",
  "name": "GENERAL DYNAMICS LAND SYSTEMS, INC. v. DENNIS CLINE et al.",
  "docket": "02-1080",
  "date_argued": "2004-02-24",
  "date_decided": "2004-02-24",
  "question_presented": "Memorization-check set: predict the Supreme Court's disposition in GENERAL DYNAMICS LAND SYSTEMS, INC. v. DENNIS CLINE et al. (540 U.S. 581, 2003 Term).",
  "facts_summary": "Historical case in the memorization-check arm. By design, only the case name, citation, and term are provided \u2014 this arm measures recall of memorized outcomes, not reasoning.",
  "lower_court_ruling": "not provided (memorization-check arm)",
  "opinion_excerpt_urls": [],
  "ground_truth": {
    "disposition": "reversed",
    "vote_split": "6-3",
    "scdb_id": "2003-031"
  },
  "status": "decided"
}
