{
  "case_id": "cl-cluster-10741339",
  "name": "Clark v. Sweeney",
  "docket": "n/a",
  "date_argued": "2025-11-24",
  "date_decided": "2025-11-24",
  "question_presented": "Cite as: 607 U. S. ____ (2025) 1 Per Curiam SUPREME COURT OF THE UNITED STATES TERENCE CLARK, DIRECTOR, PRINCE GEORGE\u2019S COUNTY DEPARTMENT OF CORRECTIONS, ET AL. v. JEREMIAH ANTOINE SWEENEY ON PETITION FOR WRIT OF CERTIORARI TO THE UNITED STATES COURT OF APPEALS FOR THE FOURTH CIRCUIT No. 25\u201352. Decided November 24, 2025 PER CURIAM. A Maryland jury found Jeremiah Sweeney guilty of second-degree murder and several other crimes. Sweeney\u2019s convictions were affirmed on appeal, and his bid for post- conviction relief in state court was unsuccessful. Sweeney sought habeas relief in Federal District Court, and that court, too, denied relief. But the Fourth Circuit reversed and ordered a new trial, relying on a claim that Sweeney never asserted.",
  "facts_summary": "Cite as: 607 U. S. ____ (2025) 1 Per Curiam SUPREME COURT OF THE UNITED STATES TERENCE CLARK, DIRECTOR, PRINCE GEORGE\u2019S COUNTY DEPARTMENT OF CORRECTIONS, ET AL. v. JEREMIAH ANTOINE SWEENEY ON PETITION FOR WRIT OF CERTIORARI TO THE UNITED STATES COURT OF APPEALS FOR THE FOURTH CIRCUIT No. 25\u201352. Decided November 24, 2025 PER CURIAM. A Maryland jury found Jeremiah Sweeney guilty of second-degree murder and several other crimes. Sweeney\u2019s convictions were affirmed on appeal, and his bid for post- conviction relief in state court was unsuccessful. Sweeney sought habeas relief in Federal District Court, and that court, too, denied relief. But the Fourth Circuit reversed and ordered a new trial, relying on a claim that Sweeney never asserted. Because the Court of Appeals departed dra- matically from the principle of party presentation, we re- verse. I According to the State\u2019s witnesses at trial, Jeremiah Sweeney was arguing one night with neighbors about sto- len marijuana. He eventually opened fire, missing his in- tended targets but killing a bystander who was about 75 yards away. At issue during trial was whether Sweeney could have been the shooter given his location and the angle of the bullet wound. After the State rested its case, Juror 4\u2019s curiosity got the best of him, and he decided to check out the crime scene for himself. Shortly after jury deliberations began, Juror 4 told the jury about his visit, and the jury promptly reported his visit to the court. The parties conferred and eventually agreed that rather than declare a mistrial, the court would dismiss Juror 4 and deliberations would proceed with 11 2 CLARK v. SWEENEY Per Curiam jurors. Sweeney was convicted, and his convictions were affirmed on direct appeal. Sweeney later filed a petition for postconviction relief in state court. He argued, among other things, that his trial counsel was ineffective under Strickland v. Washington, 466 U. S. 668, 686 (1984), for not seeking to voir dire the entire jury to ensure that no other juror was tainted by Ju- ror 4\u2019s unauthorized crime-scene visit. The state court de- nied relief after a hearing. With the help of appointed coun- sel, Sweeney then petitioned for a writ of habeas corpus under 28 U. S. C. \u00a72254 in Federal District Court. As in state court, Sweeney argued that his trial counsel was inef- fective for not seeking to voir dire the entire",
  "lower_court_ruling": "see syllabus",
  "opinion_excerpt_urls": [
    "https://www.courtlistener.com/opinion/10741339/clark-v-sweeney/"
  ],
  "ground_truth": {
    "disposition": "reversed",
    "vote_split": "unknown",
    "scdb_id": null
  },
  "status": "decided"
}
