{
  "case_id": "scdb-1965-130",
  "name": "JOHNSON et al. v. NEW JERSEY",
  "docket": "762",
  "date_argued": "1966-06-20",
  "date_decided": "1966-06-20",
  "question_presented": "Memorization-check set: predict the Supreme Court's disposition in JOHNSON et al. v. NEW JERSEY (384 U.S. 719, 1965 Term).",
  "facts_summary": "Historical case in the memorization-check arm. By design, only the case name, citation, and term are provided \u2014 this arm measures recall of memorized outcomes, not reasoning.",
  "lower_court_ruling": "not provided (memorization-check arm)",
  "opinion_excerpt_urls": [],
  "ground_truth": {
    "disposition": "affirmed",
    "vote_split": "7-2",
    "scdb_id": "1965-130"
  },
  "status": "decided"
}
