{
  "case_id": "cl-cluster-10776827",
  "name": "Fuld v. Palestine Liberation Organization",
  "docket": "n/a",
  "date_argued": "2025-06-20",
  "date_decided": "2025-06-20",
  "question_presented": "PRELIMINARY PRINT Volume 606 U. S. Part 1 Pages 1\u201345 OFFICIAL REPORTS OF THE SUPREME COURT June 20, 2025 Page Proof Pending Publication REBECCA A. WOMELDORF reporter of decisions NOTICE: This preliminary print is subject to formal revision before the bound volume is published. Users are requested to notify the Reporter of Decisions, Supreme Court of the United States, Washington, D. C. 20543, pio@supremecourt.gov, of any typographical or other formal errors. CASES ADJUDGED IN THE SUPREME COURT OF THE UNITED STATES AT OCTOBER TERM, 2024 FULD et al. v. PALESTINE LIBERATION ORGANIZATION et al. certiorari to the united states court of appeals for the second circuit Page Proof Pending Publication No. 24\u201320. Argued April 1, 2025\u2014Decided June 20, 2025* Before",
  "facts_summary": "PRELIMINARY PRINT Volume 606 U. S. Part 1 Pages 1\u201345 OFFICIAL REPORTS OF THE SUPREME COURT June 20, 2025 Page Proof Pending Publication REBECCA A. WOMELDORF reporter of decisions NOTICE: This preliminary print is subject to formal revision before the bound volume is published. Users are requested to notify the Reporter of Decisions, Supreme Court of the United States, Washington, D. C. 20543, pio@supremecourt.gov, of any typographical or other formal errors. CASES ADJUDGED IN THE SUPREME COURT OF THE UNITED STATES AT OCTOBER TERM, 2024 FULD et al. v. PALESTINE LIBERATION ORGANIZATION et al. certiorari to the united states court of appeals for the second circuit Page Proof Pending Publication No. 24\u201320. Argued April 1, 2025\u2014Decided June 20, 2025* Before the Court are two separate lawsuits fled in the United States Dis- trict Court for the Southern District of New York under the Antiterror- ism Act of 1990 (ATA). The ATA creates a federal civil damages action for U. S. nationals injured or killed \u201cby reason of an act of international terrorism.\u201d 18 U. S. C. \u00a7 2333(a); see also \u00a7 2333(d)(2) (permitting aiding and abetting liability). Respondents (defendants below) are the Pales- tine Liberation Organization (PLO) and Palestinian Authority (PA)\u2014 entities responsible for carrying out governmental functions for parts of the West Bank and Gaza Strip. The question presented is whether the exercise of personal jurisdic- tion over respondents under the Promoting Security and Justice for Vic- tims of Terrorism Act (PSJVTA) violates the Due Process Clause of the Fifth Amendment. The PSJVTA names the PA and PLO specifcally and provides that they \u201cshall be deemed to have consented to personal jurisdiction\u201d in ATA cases under two circumstances. \u00a7\u00a7 2334(e)(1), (5). The frst jurisdictional predicate relates to respondents' practice of pay- ing salaries to terrorists in Israeli prisons and to families of deceased *Together with Waldman et al. v. Palestine Liberation Organization et al. (see this Court's Rule 12.4) and No. 24\u2013151, United States v. Pales- tine Liberation Organization et al., also on certiorari to the same court. 1 2 FULD v. PALESTINE LIBERATION ORGANIZATION Syllabus terrorists\u2014conduct Congress has condemned as \u201can incentive to commit acts of terror.\u201d 132 Stat. 1143. The second ties jurisdiction to re- spondents' activities on U. S. soil. \u00a7 2334(e)(1)(B). Petitioners alleged that respondents engaged in conduct triggering both jurisdictional predicates. The Second Circuit held that the PSJVTA could not, consistent with constitutional due",
  "lower_court_ruling": "see syllabus",
  "opinion_excerpt_urls": [
    "https://www.courtlistener.com/opinion/10776827/fuld-v-palestine-liberation-organization/"
  ],
  "ground_truth": {
    "disposition": "reversed",
    "vote_split": "unknown",
    "scdb_id": null
  },
  "status": "decided"
}
